{"schema_version":"adapter-projection-compatibility-input.v0","request_summary":{"schema_version":"agentmesh-request-summary.v0","request_id":"req-1","request_digest":"sha256:0000000000000000000000000000000000000000000000000000000000000000"},"selection_decision":{"schema_version":"adapter-selection-decision-record-compact.v0","outcome":"selected","request":{"request_id":"req-1"},"candidates":{"selected":"markdown"}},"adapter_manifest":{"schema_version":"adapter-capability-manifest.v0","adapter_id":"markdown","capability_contract_version":"agentmesh-adapter-capabilities.v0"},"adapter_projection":{"schema_version":"adapter-projection.v0","projection_id":"projection-1","adapter_id":"markdown","capability_contract_version":"agentmesh-adapter-capabilities.v0","request_id":"req-2","request_digest":"sha256:2222222222222222222222222222222222222222222222222222222222222222","projection_digest":"sha256:1111111111111111111111111111111111111111111111111111111111111111","common_fields":{},"extensions":{}}}
